{
  "id": "ev-gastritis-guia-001",
  "tema_id": "gastritis",
  "tipo": "Guía clínica",
  "titulo": "Titulo de referencia pendiente de validacion",
  "organizacion": "MINSA",
  "pais": "Peru",
  "url": "https://example.org/evidencia/gastritis",
  "fecha_publicacion": "2026",
  "fecha_revision": "2026-06",
  "nivel_evidencia": "Pendiente de clasificacion",
  "resumen": "Ejemplo estructural sin contenido medico definitivo.",
  "palabras_clave": [
    "gastritis",
    "salud digestiva",
    "guia clinica"
  ],
  "idioma": "es",
  "estado": "Borrador"
}
